{
  "owner_id": "demo",
  "date": "2026-01-10",
  "model_routing": "prophet_first_arima_fallback",
  "confidence_tier": "green",
  "consecutive_missing_days": 0,
  "forecasts": [
    {
      "sku": "es_jeruk_peras",
      "sku_name": "Es Jeruk Peras",
      "category": "Minuman",
      "selected_model": "arima",
      "tier": "green",
      "tier_if_missing_3d": "yellow",
      "qty_mid": 24.85,
      "qty_low": 17.38,
      "qty_high": 32.32,
      "trend": "stable",
      "stockout_risk": false
    },
    {
      "sku": "kopi_hitam",
      "sku_name": "Kopi Hitam",
      "category": "Minuman",
      "selected_model": "arima",
      "tier": "green",
      "tier_if_missing_3d": "yellow",
      "qty_mid": 24.43,
      "qty_low": 16.01,
      "qty_high": 32.85,
      "trend": "stable",
      "stockout_risk": false
    },
    {
      "sku": "usus_goreng_crispy",
      "sku_name": "Usus Goreng Crispy",
      "category": "Makanan",
      "selected_model": "arima",
      "tier": "green",
      "tier_if_missing_3d": "yellow",
      "qty_mid": 24.37,
      "qty_low": 16.99,
      "qty_high": 31.74,
      "trend": "stable",
      "stockout_risk": false
    },
    {
      "sku": "tempe_goreng",
      "sku_name": "Tempe Goreng",
      "category": "Makanan",
      "selected_model": "arima",
      "tier": "green",
      "tier_if_missing_3d": "yellow",
      "qty_mid": 24.01,
      "qty_low": 18.22,
      "qty_high": 29.8,
      "trend": "declining",
      "stockout_risk": false
    },
    {
      "sku": "es_kelapa_muda",
      "sku_name": "Es Kelapa Muda",
      "category": "Minuman",
      "selected_model": "arima",
      "tier": "green",
      "tier_if_missing_3d": "yellow",
      "qty_mid": 23.8,
      "qty_low": 14.3,
      "qty_high": 33.3,
      "trend": "declining",
      "stockout_risk": false
    },
    {
      "sku": "cah_kangkung_terasi",
      "sku_name": "Cah Kangkung Terasi",
      "category": "Makanan",
      "selected_model": "arima",
      "tier": "green",
      "tier_if_missing_3d": "yellow",
      "qty_mid": 22.52,
      "qty_low": 13.83,
      "qty_high": 31.21,
      "trend": "growing",
      "stockout_risk": false
    }
  ],
  "profit_analysis": [
    {
      "sku": "tempe_goreng",
      "sku_name": "Tempe Goreng",
      "unit_price": 3000.0,
      "unit_cost": 1477.15,
      "revenue": 567000.0,
      "gross_profit": 287819.36,
      "margin_pct": 50.8,
      "rolling_7d_sales": 189.0,
      "rolling_7d_profit": 287819.36,
      "margin_delta": -1.4,
      "qty_prepared": null,
      "unsold_qty": null,
      "sell_through_rate": null,
      "profit_rank": 6,
      "volume_rank": 3,
      "rank_gap": -3
    },
    {
      "sku": "usus_goreng_crispy",
      "sku_name": "Usus Goreng Crispy",
      "unit_price": 19000.0,
      "unit_cost": 9143.54,
      "revenue": 3819000.0,
      "gross_profit": 1981149.33,
      "margin_pct": 51.9,
      "rolling_7d_sales": 201.0,
      "rolling_7d_profit": 1981149.33,
      "margin_delta": 0.2,
      "qty_prepared": null,
      "unsold_qty": null,
      "sell_through_rate": null,
      "profit_rank": 1,
      "volume_rank": 2,
      "rank_gap": 1
    },
    {
      "sku": "kopi_hitam",
      "sku_name": "Kopi Hitam",
      "unit_price": 8000.0,
      "unit_cost": 4390.21,
      "revenue": 1456000.0,
      "gross_profit": 656982.32,
      "margin_pct": 45.1,
      "rolling_7d_sales": 182.0,
      "rolling_7d_profit": 656982.32,
      "margin_delta": 1.9,
      "qty_prepared": null,
      "unsold_qty": null,
      "sell_through_rate": null,
      "profit_rank": 5,
      "volume_rank": 4,
      "rank_gap": -1
    },
    {
      "sku": "es_jeruk_peras",
      "sku_name": "Es Jeruk Peras",
      "unit_price": 10000.0,
      "unit_cost": 4968.04,
      "revenue": 1790000.0,
      "gross_profit": 900720.86,
      "margin_pct": 50.3,
      "rolling_7d_sales": 179.0,
      "rolling_7d_profit": 900720.86,
      "margin_delta": 0.7,
      "qty_prepared": null,
      "unsold_qty": null,
      "sell_through_rate": null,
      "profit_rank": 4,
      "volume_rank": 5,
      "rank_gap": 1
    },
    {
      "sku": "cah_kangkung_terasi",
      "sku_name": "Cah Kangkung Terasi",
      "unit_price": 12000.0,
      "unit_cost": 6005.04,
      "revenue": 2652000.0,
      "gross_profit": 1324886.08,
      "margin_pct": 50.0,
      "rolling_7d_sales": 221.0,
      "rolling_7d_profit": 1324886.08,
      "margin_delta": -1.3,
      "qty_prepared": null,
      "unsold_qty": null,
      "sell_through_rate": null,
      "profit_rank": 2,
      "volume_rank": 1,
      "rank_gap": -1
    },
    {
      "sku": "es_kelapa_muda",
      "sku_name": "Es Kelapa Muda",
      "unit_price": 12000.0,
      "unit_cost": 5736.18,
      "revenue": 1992000.0,
      "gross_profit": 1039794.02,
      "margin_pct": 52.2,
      "rolling_7d_sales": 166.0,
      "rolling_7d_profit": 1039794.02,
      "margin_delta": 1.6,
      "qty_prepared": null,
      "unsold_qty": null,
      "sell_through_rate": null,
      "profit_rank": 3,
      "volume_rank": 6,
      "rank_gap": 3
    }
  ],
  "anomaly_flags": [],
  "wa_message": "🟢 *Update Harian PIVO* — 2026-01-10\n\n📋 *Prediksi Produksi*\nSiapkan *Es Jeruk Peras* sebanyak *17–32 porsi* besok (prediksi tengah: 25).\n\n📊 *Analisis Produk*\nCek produk paling menguntungkan di dashboard PIVO.\n\n✅ *Catatan*\nHebat! Data kamu sudah cukup untuk prediksi akurat. Teruskan! 🎯\n\n_— Dikirim otomatis oleh PIVO_",
  "pwa_url": "pivo.app/u/demo",
  "skipped_skus": []
}