{
  "owner_id": "demo",
  "date": "2026-01-10",
  "model_routing": "prophet_first_arima_fallback",
  "confidence_tier": "green",
  "consecutive_missing_days": 0,
  "forecasts": [
    {
      "sku": "kopi_hitam",
      "sku_name": "Kopi Hitam",
      "category": "Minuman",
      "selected_model": "arima",
      "tier": "green",
      "tier_if_missing_3d": "yellow",
      "qty_mid": 24.43,
      "qty_low": 16.01,
      "qty_high": 32.85,
      "trend": "declining",
      "stockout_risk": false
    },
    {
      "sku": "usus_goreng_crispy",
      "sku_name": "Usus Goreng Crispy",
      "category": "Makanan",
      "selected_model": "arima",
      "tier": "green",
      "tier_if_missing_3d": "yellow",
      "qty_mid": 24.37,
      "qty_low": 16.99,
      "qty_high": 31.74,
      "trend": "declining",
      "stockout_risk": false
    },
    {
      "sku": "ayam_goreng_serayu_dada",
      "sku_name": "Ayam Goreng Serayu - Dada",
      "category": "Makanan",
      "selected_model": "arima",
      "tier": "green",
      "tier_if_missing_3d": "yellow",
      "qty_mid": 24.33,
      "qty_low": 16.41,
      "qty_high": 32.26,
      "trend": "stable",
      "stockout_risk": false
    },
    {
      "sku": "tempe_goreng",
      "sku_name": "Tempe Goreng",
      "category": "Makanan",
      "selected_model": "arima",
      "tier": "green",
      "tier_if_missing_3d": "yellow",
      "qty_mid": 24.01,
      "qty_low": 18.22,
      "qty_high": 29.8,
      "trend": "declining",
      "stockout_risk": false
    },
    {
      "sku": "nasi_merah",
      "sku_name": "Nasi Merah",
      "category": "Makanan",
      "selected_model": "arima",
      "tier": "green",
      "tier_if_missing_3d": "yellow",
      "qty_mid": 23.81,
      "qty_low": 15.58,
      "qty_high": 32.05,
      "trend": "growing",
      "stockout_risk": false
    },
    {
      "sku": "bebek_goreng_dada",
      "sku_name": "Bebek Goreng - Dada",
      "category": "Makanan",
      "selected_model": "arima",
      "tier": "green",
      "tier_if_missing_3d": "yellow",
      "qty_mid": 23.04,
      "qty_low": 13.71,
      "qty_high": 32.37,
      "trend": "growing",
      "stockout_risk": false
    }
  ],
  "profit_analysis": [
    {
      "sku": "tempe_goreng",
      "sku_name": "Tempe Goreng",
      "unit_price": 3000.0,
      "unit_cost": 1477.15,
      "revenue": 495000.0,
      "gross_profit": 251270.87,
      "margin_pct": 50.8,
      "rolling_7d_sales": 165.0,
      "rolling_7d_profit": 251270.87,
      "margin_delta": -1.4,
      "qty_prepared": null,
      "unsold_qty": null,
      "sell_through_rate": null,
      "profit_rank": 6,
      "volume_rank": 5,
      "rank_gap": -1
    },
    {
      "sku": "kopi_hitam",
      "sku_name": "Kopi Hitam",
      "unit_price": 8000.0,
      "unit_cost": 3849.91,
      "revenue": 1288000.0,
      "gross_profit": 668164.53,
      "margin_pct": 51.9,
      "rolling_7d_sales": 161.0,
      "rolling_7d_profit": 668164.53,
      "margin_delta": 0.2,
      "qty_prepared": null,
      "unsold_qty": null,
      "sell_through_rate": null,
      "profit_rank": 4,
      "volume_rank": 6,
      "rank_gap": 2
    },
    {
      "sku": "usus_goreng_crispy",
      "sku_name": "Usus Goreng Crispy",
      "unit_price": 19000.0,
      "unit_cost": 10426.74,
      "revenue": 3249000.0,
      "gross_profit": 1466027.17,
      "margin_pct": 45.1,
      "rolling_7d_sales": 171.0,
      "rolling_7d_profit": 1466027.17,
      "margin_delta": 1.9,
      "qty_prepared": null,
      "unsold_qty": null,
      "sell_through_rate": null,
      "profit_rank": 3,
      "volume_rank": 4,
      "rank_gap": 1
    },
    {
      "sku": "ayam_goreng_serayu_dada",
      "sku_name": "Ayam Goreng Serayu - Dada",
      "unit_price": 29000.0,
      "unit_cost": 14407.32,
      "revenue": 5278000.0,
      "gross_profit": 2655868.54,
      "margin_pct": 50.3,
      "rolling_7d_sales": 182.0,
      "rolling_7d_profit": 2655868.54,
      "margin_delta": 0.7,
      "qty_prepared": null,
      "unsold_qty": null,
      "sell_through_rate": null,
      "profit_rank": 2,
      "volume_rank": 3,
      "rank_gap": 1
    },
    {
      "sku": "bebek_goreng_dada",
      "sku_name": "Bebek Goreng - Dada",
      "unit_price": 35000.0,
      "unit_cost": 17514.7,
      "revenue": 7560000.0,
      "gross_profit": 3776824.58,
      "margin_pct": 50.0,
      "rolling_7d_sales": 216.0,
      "rolling_7d_profit": 3776824.58,
      "margin_delta": -1.3,
      "qty_prepared": null,
      "unsold_qty": null,
      "sell_through_rate": null,
      "profit_rank": 1,
      "volume_rank": 1,
      "rank_gap": 0
    },
    {
      "sku": "nasi_merah",
      "sku_name": "Nasi Merah",
      "unit_price": 6000.0,
      "unit_cost": 2868.09,
      "revenue": 1176000.0,
      "gross_profit": 613854.3,
      "margin_pct": 52.2,
      "rolling_7d_sales": 196.0,
      "rolling_7d_profit": 613854.3,
      "margin_delta": 1.6,
      "qty_prepared": null,
      "unsold_qty": null,
      "sell_through_rate": null,
      "profit_rank": 5,
      "volume_rank": 2,
      "rank_gap": -3
    }
  ],
  "anomaly_flags": [],
  "wa_message": "🟢 *Update Harian PIVO* — 2026-01-10\n\n📋 *Prediksi Produksi*\nSiapkan *Kopi Hitam* sebanyak *16–33 porsi* besok (prediksi tengah: 24).\n\n📊 *Analisis Produk*\nCek produk paling menguntungkan di dashboard PIVO.\n\n✅ *Catatan*\nHebat! Data kamu sudah cukup untuk prediksi akurat. Teruskan! 🎯\n\n_— Dikirim otomatis oleh PIVO_",
  "pwa_url": "pivo.app/u/demo",
  "skipped_skus": []
}